"1259609334465642497","https://twitter.com/dsunderhood/status/1259609334465642497","Поздноночный прощальный тред про железо","2020-05-10 22:20 +0000","2923.0","257.0","0.08792336640437906","2.0","1.0","14.0","23.0","0.0","0.0","217.0","0.0","0","0","0","0","0","0","0","-","-","-","-","-","-","-","-","-","-","-","-","-","-","-","-","-","-"
"1259608994940846081","https://twitter.com/dsunderhood/status/1259608994940846081","@khlevnov Обоснование примерно такое же как у вас. Набил шишек в свое время, больше не хочу.","2020-05-10 22:19 +0000","35.0","1.0","0.02857142857142857","0.0","1.0","0.0","0.0","0.0","0.0","0.0","0.0","0","0","0","0","0","0","0","-","-","-","-","-","-","-","-","-","-","-","-","-","-","-","-","-","-"
"1259608840703705088","https://twitter.com/dsunderhood/status/1259608840703705088","@khlevnov Мне к сожалению не известно никаких альтернатив для него, кроме скриптов. Jupyter я использую только когда надо что-то быстро повизуализировать, или когда я хочу обработать данные, но пока не знаю как, и думаю в процессе. Все остальное в скриптах, написанных в ide.","2020-05-10 22:18 +0000","30.0","2.0","0.06666666666666667","0.0","1.0","0.0","0.0","0.0","0.0","1.0","0.0","0","0","0","0","0","0","0","-","-","-","-","-","-","-","-","-","-","-","-","-","-","-","-","-","-"
"1258806877229584386","https://twitter.com/dsunderhood/status/1258806877229584386","ТЛДР: у ребят аккумулировался градиент и в итоге они обучились на валидации","2020-05-08 17:12 +0000","1288.0","22.0","0.017080745341614908","1.0","0.0","5.0","7.0","0.0","0.0","9.0","0.0","0","0","0","0","0","0","0","-","-","-","-","-","-","-","-","-","-","-","-","-","-","-","-","-","-"
"1258806874356494337","https://twitter.com/dsunderhood/status/1258806874356494337","Тут в ленту только что прилетела идеальная иллюстрация зачем вообще использовать открытые популярные трейнлупы вместо своих велосипедов:
Академики скопипастили луп из другой статьи вместе с багом. В итоге результаты у них невалидные https://t.co/F1twKxOn6y","2020-05-08 17:12 +0000","1422.0","35.0","0.02461322081575246","0.0","1.0","4.0","3.0","15.0","0.0","12.0","0.0","0","0","0","0","0","0","0","-","-","-","-","-","-","-","-","-","-","-","-","-","-","-","-","-","-"
"1258503594178904065","https://twitter.com/dsunderhood/status/1258503594178904065","@vovapolu Дата-классы завезли в 3.7 
В остальном да, но это уже сильно лучше, чем ничего, которое было раньше.","2020-05-07 21:06 +0000","197.0","1.0","0.005076142131979695","0.0","0.0","1.0","0.0","0.0","0.0","0.0","0.0","0","0","0","0","0","0","0","-","-","-","-","-","-","-","-","-","-","-","-","-","-","-","-","-","-"
"1258497353809526784","https://twitter.com/dsunderhood/status/1258497353809526784","Кажется что многие. Мне это тоже не нравится. 
Каталист как раз пытался сделать так, чтобы копировать вообще ничего не надо было в большей части случаев. Вышло так себе, на мой взгляд.
А лайтнингу не хватает небольших блоков, которые можно было бы комбинировать между собой. https://t.co/b3MKcxTOOH","2020-05-07 20:42 +0000","1850.0","47.0","0.025405405405405406","1.0","0.0","3.0","11.0","0.0","0.0","32.0","0.0","0","0","0","0","0","0","0","-","-","-","-","-","-","-","-","-","-","-","-","-","-","-","-","-","-"
"1258496313395744771","https://twitter.com/dsunderhood/status/1258496313395744771","@Yetishkin_P Изначально тем, что в пайтоне есть типы. А про то зачем их указывать написано в треде.","2020-05-07 20:37 +0000","335.0","12.0","0.03582089552238806","0.0","1.0","1.0","3.0","0.0","0.0","7.0","0.0","0","0","0","0","0","0","0","-","-","-","-","-","-","-","-","-","-","-","-","-","-","-","-","-","-"
"1258493511864909825","https://twitter.com/dsunderhood/status/1258493511864909825","В общем я верю, что мы можем лучше. Смотрите как сделано в чужих трейнлупах, пробуйте обсуждать идеи с коллегами, засылать PR ментейнерам. Пробуйте сделать свой трейнлуп как у X, только лучше. Возможно мы когда-нибудь получим удобный инструмент который не будет вызывать боль","2020-05-07 20:26 +0000","1675.0","41.0","0.02447761194029851","0.0","3.0","4.0","4.0","0.0","0.0","30.0","0.0","0","0","0","0","0","0","0","-","-","-","-","-","-","-","-","-","-","-","-","-","-","-","-","-","-"
"1258493509822226432","https://twitter.com/dsunderhood/status/1258493509822226432","Еще не хватает хотя бы опционального стандартного способа все таки грузить конфиги. Причем я не один такой, например вот тут @AndLukyane 
пилит для этого свой костыль https://t.co/VDFA5nrP5o","2020-05-07 20:26 +0000","1428.0","32.0","0.022408963585434174","0.0","1.0","3.0","4.0","18.0","0.0","6.0","0.0","0","0","0","0","0","0","0","-","-","-","-","-","-","-","-","-","-","-","-","-","-","-","-","-","-"
"1258493507750281216","https://twitter.com/dsunderhood/status/1258493507750281216","Местами скудная документация, некоторые решения тоже очень странные: argparse.Namespace для передачи гиперпараметров (https://t.co/cmQ3jn06c4),  очень странный форматы ретёрнов (https://t.co/wvkLljgYTT), гигантское количество параметров в конструкторах (https://t.co/XgXmuvZRhH)","2020-05-07 20:26 +0000","663.0","27.0","0.04072398190045249","0.0","1.0","5.0","2.0","14.0","0.0","5.0","0.0","0","0","0","0","0","0","0","-","-","-","-","-","-","-","-","-","-","-","-","-","-","-","-","-","-"
"1258493505732780033","https://twitter.com/dsunderhood/status/1258493505732780033","Сейчас я пользуюсь lightning, и идея ""давайте просто писать на торче, но немного более структурированно"" на практике оказывается очень удобной. Но конечно в деталях там тоже есть проблемы.","2020-05-07 20:26 +0000","668.0","13.0","0.019461077844311378","0.0","1.0","5.0","1.0","0.0","0.0","6.0","0.0","0","0","0","0","0","0","0","-","-","-","-","-","-","-","-","-","-","-","-","-","-","-","-","-","-"
"1258493503832719362","https://twitter.com/dsunderhood/status/1258493503832719362","Да и до этого периодически замечал что больше думаю как реализовать какую-то идею в рамках фреймворка, чем думаю над самой идеей.  Тоже показатель того, что что-то не так. Не представляю что чувствуют люди, у которых никогда не было моего уровня погружения в устройство каталиста.","2020-05-07 20:26 +0000","681.0","4.0","0.005873715124816446","0.0","1.0","2.0","0.0","0.0","0.0","1.0","0.0","0","0","0","0","0","0","0","-","-","-","-","-","-","-","-","-","-","-","-","-","-","-","-","-","-"
"1258493501920161798","https://twitter.com/dsunderhood/status/1258493501920161798","Окончательно я попрощался с использованием фреймворка, который сам когда-то разрабатывал, после того как уже будучи не в кор-тим и не пользуясь им регулярно, после очередного апдейта с трудом разобрался как сделать несколько лоссов. Примеров не было, документации не было. Финиш.","2020-05-07 20:26 +0000","656.0","6.0","0.009146341463414634","0.0","1.0","4.0","0.0","0.0","0.0","1.0","0.0","0","0","0","0","0","0","0","-","-","-","-","-","-","-","-","-","-","-","-","-","-","-","-","-","-"
"1258493499844055065","https://twitter.com/dsunderhood/status/1258493499844055065","Коллбеки же очень неудобны из-за неявных зависимостей между ними через мутный стейт, которые вынуждают проверять их порядок и требуют костылей в виде захардкоженого order (https://t.co/gIkLed97gN)","2020-05-07 20:26 +0000","608.0","11.0","0.018092105263157895","0.0","1.0","4.0","0.0","1.0","0.0","5.0","0.0","0","0","0","0","0","0","0","-","-","-","-","-","-","-","-","-","-","-","-","-","-","-","-","-","-"
"1258493497805545472","https://twitter.com/dsunderhood/status/1258493497805545472","С конфигами мои претензии очень похожи на то что описано в этой статье https://t.co/GaWEZIwuOt. Если в кратце сложные конфиги превращаются в ненужный неудобный язык программирования, либо даже не покрывают достаточное количество кейсов и код все равно приходится писать.","2020-05-07 20:26 +0000","196.0","4.0","0.02040816326530612","0.0","1.0","1.0","0.0","1.0","0.0","1.0","0.0","0","0","0","0","0","0","0","-","-","-","-","-","-","-","-","-","-","-","-","-","-","-","-","-","-"
"1258493495779774471","https://twitter.com/dsunderhood/status/1258493495779774471","А какие-то, к сожалению, не прошли проверку временем, кмк. Например конфиги (в том виде, в котором они есть в catalyst), или система коллбеков.","2020-05-07 20:26 +0000","611.0","6.0","0.009819967266775777","0.0","1.0","1.0","0.0","0.0","0.0","4.0","0.0","0","0","0","0","0","0","0","-","-","-","-","-","-","-","-","-","-","-","-","-","-","-","-","-","-"
"1258493493346959361","https://twitter.com/dsunderhood/status/1258493493346959361","Например раньше я был членом кор-тим каталиста и пытался сделать классную удобную архитектуру. Какие-то абстракции у нас получились удобными, и я ими до сих пор доволен, (например разделение experiment/runner).","2020-05-07 20:26 +0000","540.0","7.0","0.012962962962962963","0.0","1.0","1.0","2.0","0.0","0.0","3.0","0.0","0","0","0","0","0","0","0","-","-","-","-","-","-","-","-","-","-","-","-","-","-","-","-","-","-"
"1258493491363053568","https://twitter.com/dsunderhood/status/1258493491363053568","Мой тейк в том, что сейчас все не очень хорошо, и мы еще только на пути к удобным абстракциям. Все эволюционирует, какие-то идеи выстреливают, какие-то нет.","2020-05-07 20:26 +0000","510.0","3.0","0.0058823529411764705","0.0","1.0","1.0","1.0","0.0","0.0","0.0","0.0","0","0","0","0","0","0","0","-","-","-","-","-","-","-","-","-","-","-","-","-","-","-","-","-","-"
"1258489675074994193","https://twitter.com/dsunderhood/status/1258489675074994193","Какой трейнлуп вы используете в торче","2020-05-07 20:11 +0000","617.0","43.0","0.06969205834683954","0.0","2.0","1.0","3.0","0.0","0.0","11.0","0.0","0","0","0","0","0","0","0","-","-","-","-","-","-","-","-","-","-","-","-","-","-","-","-","-","-"
"1258489670389895174","https://twitter.com/dsunderhood/status/1258489670389895174","Завершая поток мыслей про инженеринг, затрону вечный холивар юзеров пайторча за трейнлупы (да простят меня юзеры tf, theano и caffe если они еще не вымерли)","2020-05-07 20:11 +0000","731.0","11.0","0.015047879616963064","1.0","1.0","1.0","0.0","0.0","0.0","8.0","0.0","0","0","0","0","0","0","0","-","-","-","-","-","-","-","-","-","-","-","-","-","-","-","-","-","-"
"1258489668410236930","https://twitter.com/dsunderhood/status/1258489668410236930","Трейнлупы","2020-05-07 20:11 +0000","3424.0","132.0","0.038551401869158876","1.0","1.0","3.0","14.0","0.0","0.0","113.0","0.0","0","0","0","0","0","0","0","-","-","-","-","-","-","-","-","-","-","-","-","-","-","-","-","-","-"
"1258478766491344903","https://twitter.com/dsunderhood/status/1258478766491344903","А если же в вашем коде нет ни одного класса и между функциями вы гоняете только дикты листов диктов неясного содержания, или у вас нет функций, аннотации вас не сильно спасут. Вам стоит начать с книги Сlean Сode, чтобы понять, как можно писать код лучше и почему это стоит делать.","2020-05-07 19:28 +0000","1833.0","66.0","0.03600654664484452","1.0","2.0","13.0","9.0","0.0","0.0","41.0","0.0","0","0","0","0","0","0","0","-","-","-","-","-","-","-","-","-","-","-","-","-","-","-","-","-","-"
"1258478764406837248","https://twitter.com/dsunderhood/status/1258478764406837248","А если хотите просто прикрутить все best practices в новый проект сразу, то вам в этот стартер-проект https://t.co/ScLgh9vvbN (Im a bit affilated)","2020-05-07 19:28 +0000","2270.0","97.0","0.042731277533039645","2.0","1.0","8.0","7.0","54.0","0.0","25.0","0.0","0","0","0","0","0","0","0","-","-","-","-","-","-","-","-","-","-","-","-","-","-","-","-","-","-"
"1258478762427125762","https://twitter.com/dsunderhood/status/1258478762427125762","Вообще практики разработки больших проекты на пайтоне без особых болей активно развиваются, и не ограничиваются только типизацией. Хороший обзор можно тренди штук можно почитать в этой серии постов https://t.co/MvLC00SFZA.","2020-05-07 19:28 +0000","769.0","74.0","0.09622886866059818","0.0","2.0","11.0","0.0","47.0","0.0","14.0","0.0","0","0","0","0","0","0","0","-","-","-","-","-","-","-","-","-","-","-","-","-","-","-","-","-","-"
"1258478760359231488","https://twitter.com/dsunderhood/status/1258478760359231488","Еще типы в пайтоне позволяют писать меньше кода: яркие примеры это https://t.co/nALYH9vQFG (как фласк, только быстрее и удобнее), https://t.co/mDx54qsQJc — argparse/fire на стероидах, который сокращает количество boilerplate.","2020-05-07 19:28 +0000","662.0","43.0","0.0649546827794562","0.0","1.0","6.0","0.0","32.0","0.0","4.0","0.0","0","0","0","0","0","0","0","-","-","-","-","-","-","-","-","-","-","-","-","-","-","-","-","-","-"
"1258478758148915202","https://twitter.com/dsunderhood/status/1258478758148915202","В теории в будущем можно будет автоматически проверить правильность dtype в ndarray, или выводить шейпы на выходе по шейпам на входе. Работы в этом направлении ведутся https://t.co/tNWH6etxIx","2020-05-07 19:28 +0000","609.0","22.0","0.0361247947454844","0.0","1.0","7.0","1.0","10.0","0.0","3.0","0.0","0","0","0","0","0","0","0","-","-","-","-","-","-","-","-","-","-","-","-","-","-","-","-","-","-"
"1258478756274016258","https://twitter.com/dsunderhood/status/1258478756274016258","Статическая проверка когда: Их можно использовать для настоящей статической проверки всего через mypy https://t.co/yzFy8Ys9Od. Его так же можно постепенно внедрять в старый код без аннотаций. Этот инструмент сильно сократит вам количество багов и сэкономит кучу часов дебага.","2020-05-07 19:28 +0000","635.0","8.0","0.012598425196850394","0.0","1.0","2.0","1.0","2.0","0.0","2.0","0.0","0","0","0","0","0","0","0","-","-","-","-","-","-","-","-","-","-","-","-","-","-","-","-","-","-"
"1258478754474704897","https://twitter.com/dsunderhood/status/1258478754474704897","При помощи таких подсказок начинаешь реже сомневаться в том что делаешь, реже лазаешь по коду в попытках найти, что лежит в foo, реже переходите в браузер полистать доку и вообще лучше понимаешь что происходит. Нужные изменения вносятся быстрее при меньших затратах мыслетоплева.","2020-05-07 19:28 +0000","569.0","3.0","0.005272407732864675","0.0","1.0","2.0","0.0","0.0","0.0","0.0","0.0","0","0","0","0","0","0","0","-","-","-","-","-","-","-","-","-","-","-","-","-","-","-","-","-","-"
"1258478752637599744","https://twitter.com/dsunderhood/status/1258478752637599744","IDE становится более полезной: показывает  какие поля и методы есть у объекта, возвращаемого из функции, показывает какие параметры есть у методов и напоминает какие типы надо в них передавать. Подсветить связанные с этим потенциальные ошибки.","2020-05-07 19:28 +0000","579.0","2.0","0.0034542314335060447","0.0","1.0","1.0","0.0","0.0","0.0","0.0","0.0","0","0","0","0","0","0","0","-","-","-","-","-","-","-","-","-","-","-","-","-","-","-","-","-","-"
"1258478750846648321","https://twitter.com/dsunderhood/status/1258478750846648321","Даже тем кто никогда не писал на статически типизированных языках, или очень хочет оставить себе возможность засунуть str там где нужно засовывать int.","2020-05-07 19:28 +0000","583.0","3.0","0.005145797598627788","0.0","1.0","2.0","0.0","0.0","0.0","0.0","0.0","0","0","0","0","0","0","0","-","-","-","-","-","-","-","-","-","-","-","-","-","-","-","-","-","-"
"1258478748271288320","https://twitter.com/dsunderhood/status/1258478748271288320","Начиная с версии 3.6 в пайтон завезли аннотации типами для сигнатур функций и переменных. Я попробую объяснить почему это круто и вам нужно начать их использовать.","2020-05-07 19:28 +0000","665.0","14.0","0.021052631578947368","0.0","1.0","4.0","1.0","0.0","0.0","8.0","0.0","0","0","0","0","0","0","0","-","-","-","-","-","-","-","-","-","-","-","-","-","-","-","-","-","-"
"1258478746664869889","https://twitter.com/dsunderhood/status/1258478746664869889","Типизация в Python","2020-05-07 19:28 +0000","3242.0","358.0","0.11042566317088218","2.0","2.0","18.0","28.0","0.0","0.0","308.0","0.0","0","0","0","0","0","0","0","-","-","-","-","-","-","-","-","-","-","-","-","-","-","-","-","-","-"
"1258092050903453697","https://twitter.com/dsunderhood/status/1258092050903453697","Можете ли вы задеплоить весь пайплайн сами и если нет, замедляет ли оно вас?","2020-05-06 17:51 +0000","1403.0","46.0","0.03278688524590164","0.0","0.0","0.0","8.0","0.0","0.0","10.0","0.0","0","0","0","0","0","0","0","-","-","-","-","-","-","-","-","-","-","-","-","-","-","-","-","-","-"
"1258092046323257345","https://twitter.com/dsunderhood/status/1258092046323257345","Обучаете ли вы модели в докере","2020-05-06 17:51 +0000","1323.0","71.0","0.05366591080876795","0.0","2.0","1.0","0.0","0.0","0.0","25.0","0.0","0","0","0","0","0","0","0","-","-","-","-","-","-","-","-","-","-","-","-","-","-","-","-","-","-"
"1258089931370528768","https://twitter.com/dsunderhood/status/1258089931370528768","4.2/
Я когда-то делал доклад про нее https://t.co/FKnekFrQPZ (c середины). Он немного устарел, часть проблем которые я там обозначил уже исправлены, но общий расклад не поменялся. По крайне туманным для меня причинам, к сожалению, она почти никем не используется.","2020-05-06 17:43 +0000","615.0","40.0","0.06504065040650407","0.0","1.0","2.0","3.0","9.0","0.0","21.0","0.0","0","0","0","0","0","4","4","-","-","-","-","-","-","-","-","-","-","-","-","-","-","-","-","-","-"
"1258089928371691521","https://twitter.com/dsunderhood/status/1258089928371691521","4.1/
Существует отличная альтернатива докеру под названием singularity. https://t.co/NcPBl4RVTb,: работает только под вашим юзером, монтирует текущую рабочую директорию по умолчанию, из коробки умеет работать с гпу, полностью поддерживает образы от докера.","2020-05-06 17:43 +0000","601.0","32.0","0.05324459234608985","0.0","2.0","6.0","1.0","15.0","0.0","8.0","0.0","0","0","0","0","0","0","0","-","-","-","-","-","-","-","-","-","-","-","-","-","-","-","-","-","-"
"1258088450886111232","https://twitter.com/dsunderhood/status/1258088450886111232","3.6/
Не говоря уже о проблемах с безопасностью в случае когда кто-то специально захочет что-то сломать.","2020-05-06 17:37 +0000","596.0","4.0","0.006711409395973154","0.0","1.0","2.0","0.0","0.0","0.0","1.0","0.0","0","0","0","0","0","0","0","-","-","-","-","-","-","-","-","-","-","-","-","-","-","-","-","-","-"
"1258088446507261953","https://twitter.com/dsunderhood/status/1258088446507261953","3.5/
И сделать это может как джун, вчера впервые в жизни открывший консоль, так и матерый разраб, который просто поставил пробел не в том месте и не заметил. Знакомые рассказывали, что кто-то подобным образом сломал ось на DGX.","2020-05-06 17:37 +0000","536.0","7.0","0.013059701492537313","0.0","1.0","1.0","0.0","0.0","0.0","5.0","0.0","0","0","0","0","0","0","0","-","-","-","-","-","-","-","-","-","-","-","-","-","-","-","-","-","-"
"1258088443718119425","https://twitter.com/dsunderhood/status/1258088443718119425","3.4/
Второе веселее - эта команда не спросит, уверен ли ты, а система работать практически перестанет. Попробуйте на досуге в виртуалке. Не на реальной тачке!","2020-05-06 17:37 +0000","442.0","2.0","0.004524886877828055","0.0","1.0","0.0","0.0","0.0","0.0","1.0","0.0","0","0","0","0","0","0","0","-","-","-","-","-","-","-","-","-","-","-","-","-","-","-","-","-","-"
"1258088441071493121","https://twitter.com/dsunderhood/status/1258088441071493121","3.3/
Кто-то обязательно пожалуется, что не может удалить файлы, созданные в контейнере, находясь снаружи него, и что ему нужно sudo. А получив его, обязательно сделает 'rm -rf /' или 'сhmod 777 -R /'","2020-05-06 17:37 +0000","445.0","5.0","0.011235955056179775","0.0","2.0","0.0","0.0","0.0","0.0","3.0","0.0","0","0","0","0","0","0","0","-","-","-","-","-","-","-","-","-","-","-","-","-","-","-","-","-","-"
"1258088439007895557","https://twitter.com/dsunderhood/status/1258088439007895557","3.1/
Отдельная проблема это root-права, которые включены по дефолту. Особенно когда речь идет об общем кластере, что в глубоком обучении довольно распространено, каждому под стол тачку с 4мя картами не поставишь.","2020-05-06 17:37 +0000","427.0","2.0","0.00468384074941452","0.0","1.0","0.0","0.0","0.0","0.0","1.0","0.0","0","0","0","0","0","0","0","-","-","-","-","-","-","-","-","-","-","-","-","-","-","-","-","-","-"
